{
  "name": "Mariadb",
  "description": "MariaDB Database for relational SQL",
  "extends": "oci-image",
  "icon": "icon.svg",
  "installation": [
    {
      "name": "mariadb1-parameters.json",
      "before": "011-get-oci-image.json"
    }
  ],
  "url": "https://github.com/MariaDB/mariadb-docker",
  "documentation": "https://hub.docker.com/_/mariadb/",
  "source": "https://github.com/MariaDB/mariadb-docker",
  "vendor": "MariaDB Community"
}